{"accessEventId":"development-oracle-access.evidence-v1","accessedAt":"2026-07-31T08:02:00.000Z","accessor":{"identityDigest":"sha256:5e3dc044c49e00e0a435a277126d8a4e1fced3d0b1f781686df24139ac528a4b","implementationDigest":"sha256:9e7ccbff8d1987e81dc018f4898222f9920db02028449e996f1a2251e6a381b5","instanceId":"evaluator.development-attribution-scorer.instance","principalId":"evaluator.development-attribution-scorer","role":"evaluator"},"attestation":{"algorithm":"Ed25519","keyId":"evaluator.development-attribution-scorer.development-ed25519","signature":"1osSEViRM2AIEwBrmRmpEBTA16bI6QVVleVLjdDhAMTY-Xr9EwGW3qMfBpRXwsHlGteCBHbXCeCAirfkxE_pBA"},"claimBoundary":{"attributionPerformanceClaim":false,"authorizedForResearchEvidence":false,"confirmatory":false,"developmentOnly":true,"publicVisibleFixtures":true},"eventHash":"sha256:60ff1831f5ba1fed769ab1c58e3464e318d070364ebf493731936f41c1713079","oracleBundleHash":"sha256:3939347127af9bdb443f4f93be41e0434d546d17514b5deae5ffc04552d2d21a","oracleRecordHashes":["sha256:0e5238946c11b2c1994943ecc6f912f7e28b8e93b1e80731fe826d738b253160","sha256:10a86dd0ae15c1a69909cc4b54e9e7a0856116b5912df29eeef4521920ca4f1b","sha256:15c2077a1a4f8a8736d19c186cf027897965a183b4af582811462c9cd9bbfd0e","sha256:1b5fb3504db97f9d0f8e5794b77e68a5e8baca6a0110328147f9da75999443f2","sha256:1de72cd3acdf706959af8127be35ea50d6ba7363384b1f4027978009bfbe9898","sha256:206c31470810c75fd1e0d89f81728de4ecf2de72197463fb32ed66bf601a0ba5","sha256:24379ed6fb1953a3cc27c461033f6f2287f751294e9b0033f5cf8ab2cf71104d","sha256:319646f01d44ddd0a70cf11cf9de62d01525340937a827d39b92aec9deaacb13","sha256:33ad0e9a3b001fd252c9cb22b7b621ebdfeb7db63f39e21400421f412a7d3e50","sha256:386f8e10455da549d29fc8987e18b73f1bd5641387163886e6c082c5ec269114","sha256:3b2d233284c8478eb85dc0694ff707e8a1a11d06ab1ffe45455dfde16fc2a51e","sha256:3f70535f3353086e790d287a181c44a6a2adba43461ad43ce194f4a3441367e3","sha256:5272854ab81ef9894f9b709aecb17fc37847e040e1e073628abbb6b99788ca50","sha256:56ff87df831ec2f3a84fd54805eb299e5dfce4f8acb767f5a05c8afc2f76967b","sha256:59daba44487373c71bb6f641ee80d6cc3723f76916dc71de4933c2a7e16b029b","sha256:5b0f3217e4446a4665a09e87a7d4533cc659c5b5285761a64369baeebb4e03f1","sha256:6303e1d84e445c378d92d3231ed16d9d5d310d0d6cfa6c551ba8af9d861a8ad4","sha256:689d46103ea5dc3966b69c5c3d059750014f5ae9b9137fe63c3c49954b998329","sha256:7b379fb1ef3b0e08b092bf7fda6f64d0c46cb205106847b350031bedfffb6b14","sha256:9557ae3b9ba1ca4c88a7e68bf61c3d36e20ac7bbff975c8c36402cbcf4dd5c31","sha256:a409dc8364048f199148e5ad92a41ee1cef2e2e10dcf0144e47832ab8029c6e9","sha256:a48f40bc6c2b44f7af60033c0932cf52f3b4134842ed1e43d8d9f83f614bc654","sha256:a9d5efd5158cf1e259705d39bbaed8d703506c20f008f8c54874107e97a9d9b9","sha256:c3c37e45bec48d45d8c4205623559e270cdd6810011c86f0281de7a426bbe5e8","sha256:d1d1ee5fb614ee11de3f27773acb92c22f038be8a108e59bce284cff0cd201e6","sha256:dd321638484fe78e448058e5e8c580efc9111e3cb3f87c543882280d0d5107c5","sha256:de502d2ce70c930fbd9f75833f5ff0e08c9265d9ff3e05598350396a7239592c","sha256:ea9a2b09a1be0ffaf09089b34e0821c6841e67c5a1d7346aee8f50bb7f48e075"],"predictionCommitmentHash":"sha256:583fea8371ac7a7b5a68470a535c89adbb5aa9ce8fcc4d4157bea46b7ceac393","predictionCommitmentVerified":true,"publicPrincipal":{"identity":{"identityDigest":"sha256:5e3dc044c49e00e0a435a277126d8a4e1fced3d0b1f781686df24139ac528a4b","implementationDigest":"sha256:9e7ccbff8d1987e81dc018f4898222f9920db02028449e996f1a2251e6a381b5","instanceId":"evaluator.development-attribution-scorer.instance","principalId":"evaluator.development-attribution-scorer","role":"evaluator"},"keyId":"evaluator.development-attribution-scorer.development-ed25519","publicKeyPem":"-----BEGIN PUBLIC KEY-----\nMCowBQYDK2VwAyEAGX9rI+FshTLGq8g4+s1ep4m+DHaykgM0A5v6iz02jWE=\n-----END PUBLIC KEY-----\n"},"purpose":"development_scoring","schemaVersion":1}
